{
  "case_id": "n31_media_change",
  "configuration": {
    "candidate_padding_ms": 1000,
    "merge_gap_ms": 1000
  },
  "data_policy": {
    "contains_absolute_paths": false,
    "contains_credentials": false,
    "contains_raw_media": false,
    "external_model_calls_for_window_generation": 0
  },
  "generated_at": "2026-07-17T05:28:01.525033+00:00",
  "input_bindings": {
    "dgx_visual_sha256": "b475c03d34b4a5db8c423b97f72fdfc11d1d5e99e28c699ed2cac6fc912ab9fb",
    "gold_sop_sha256": "a8f111a52f496f93e9934cedd493630d73732ad73e6e4e79832f0133c31c6f8a",
    "visual_review_sha256": "9bed709fe0c994c7e7403108dadb1ec08519547d7eea025bdcd9aa01f8bad18d"
  },
  "model_calls": 0,
  "report_id": "N31_TEMPORAL_ACTION_WINDOWS_V1",
  "semantic_claim_scope": "GOLD_ALIGNED_CANDIDATE_WINDOW_ONLY",
  "status": "COMPLETED",
  "summary": {
    "contradicted_step_count": 0,
    "multi_source_step_count": 6,
    "not_visible_step_count": 1,
    "partial_step_count": 12,
    "required_step_count": 10,
    "selected_frame_reference_count": 51,
    "source_count": 6,
    "source_ids": [
      "N31_VIDEO_GUIDES",
      "N31_VIDEO_LEARNING",
      "N31_VIDEO_MEDIA_FEED",
      "N31_VIDEO_MEDIA_TYPE",
      "N31_VIDEO_OPERATION_FULL",
      "N31_VIDEO_PRINT_RESULT"
    ],
    "step_count": 13,
    "supported_step_count": 0,
    "unique_dgx_candidate_count": 41,
    "window_count": 19,
    "window_with_dgx_candidate_count": 12
  },
  "upstream_visual_model": "step-3.7-flash",
  "upstream_visual_model_calls": 13,
  "version": 1,
  "windows": [
    {
      "dgx_candidate_count": 1,
      "dgx_candidate_timestamps_ms": [
        0
      ],
      "duration_ms": 10000,
      "end_ms": 10000,
      "evidence_ids": [
        "E001",
        "E002"
      ],
      "privacy_observation": "POTENTIAL_SENSITIVE_CONTENT",
      "required": true,
      "selected_frame_count": 2,
      "source_ref": "N31_VIDEO_OPERATION_FULL",
      "start_ms": 0,
      "step_id": "S01",
      "title": "核对设备和介质适配性",
      "visual_confidence": 0.7,
      "visual_verdict": "PARTIAL",
      "window_id": "S01-W01"
    },
    {
      "dgx_candidate_count": 4,
      "dgx_candidate_timestamps_ms": [
        0,
        6000,
        8000,
        9000
      ],
      "duration_ms": 10000,
      "end_ms": 10000,
      "evidence_ids": [
        "E066",
        "E067"
      ],
      "privacy_observation": "NO_SENSITIVE_CONTENT_VISIBLE",
      "required": true,
      "selected_frame_count": 2,
      "source_ref": "N31_VIDEO_MEDIA_TYPE",
      "start_ms": 0,
      "step_id": "S02",
      "title": "判断缝标定位方式",
      "visual_confidence": 0.6,
      "visual_verdict": "PARTIAL",
      "window_id": "S02-W01"
    },
    {
      "dgx_candidate_count": 2,
      "dgx_candidate_timestamps_ms": [
        41000,
        44000
      ],
      "duration_ms": 15000,
      "end_ms": 50000,
      "evidence_ids": [
        "E008",
        "E009",
        "E010"
      ],
      "privacy_observation": "POTENTIAL_SENSITIVE_CONTENT",
      "required": true,
      "selected_frame_count": 3,
      "source_ref": "N31_VIDEO_OPERATION_FULL",
      "start_ms": 35000,
      "step_id": "S03",
      "title": "检查初始状态",
      "visual_confidence": 0.6,
      "visual_verdict": "PARTIAL",
      "window_id": "S03-W01"
    },
    {
      "dgx_candidate_count": 3,
      "dgx_candidate_timestamps_ms": [
        62000,
        63000,
        67000
      ],
      "duration_ms": 15000,
      "end_ms": 75000,
      "evidence_ids": [
        "E013",
        "E014",
        "E015"
      ],
      "privacy_observation": "POTENTIAL_SENSITIVE_CONTENT",
      "required": true,
      "selected_frame_count": 3,
      "source_ref": "N31_VIDEO_OPERATION_FULL",
      "start_ms": 60000,
      "step_id": "S04",
      "title": "连接电源并开机",
      "visual_confidence": 0.9,
      "visual_verdict": "NOT_VISIBLE",
      "window_id": "S04-W01"
    },
    {
      "dgx_candidate_count": 1,
      "dgx_candidate_timestamps_ms": [
        95000
      ],
      "duration_ms": 15000,
      "end_ms": 95000,
      "evidence_ids": [
        "E017",
        "E018",
        "E019"
      ],
      "privacy_observation": "POTENTIAL_SENSITIVE_CONTENT",
      "required": false,
      "selected_frame_count": 3,
      "source_ref": "N31_VIDEO_OPERATION_FULL",
      "start_ms": 80000,
      "step_id": "S05",
      "title": "打开顶盖并检查内部纸路",
      "visual_confidence": 0.5,
      "visual_verdict": "PARTIAL",
      "window_id": "S05-W01"
    },
    {
      "dgx_candidate_count": 0,
      "dgx_candidate_timestamps_ms": [],
      "duration_ms": 15000,
      "end_ms": 120000,
      "evidence_ids": [
        "E022",
        "E023",
        "E024"
      ],
      "privacy_observation": "POTENTIAL_SENSITIVE_CONTENT",
      "required": false,
      "selected_frame_count": 3,
      "source_ref": "N31_VIDEO_OPERATION_FULL",
      "start_ms": 105000,
      "step_id": "S06",
      "title": "调节内部导纸夹",
      "visual_confidence": 0.4,
      "visual_verdict": "PARTIAL",
      "window_id": "S06-W01"
    },
    {
      "dgx_candidate_count": 3,
      "dgx_candidate_timestamps_ms": [
        0,
        5000,
        6000
      ],
      "duration_ms": 10000,
      "end_ms": 10000,
      "evidence_ids": [
        "E069",
        "E070"
      ],
      "privacy_observation": "POTENTIAL_SENSITIVE_CONTENT",
      "required": false,
      "selected_frame_count": 2,
      "source_ref": "N31_VIDEO_GUIDES",
      "start_ms": 0,
      "step_id": "S06",
      "title": "调节内部导纸夹",
      "visual_confidence": 0.4,
      "visual_verdict": "PARTIAL",
      "window_id": "S06-W02"
    },
    {
      "dgx_candidate_count": 1,
      "dgx_candidate_timestamps_ms": [
        134000
      ],
      "duration_ms": 15000,
      "end_ms": 150000,
      "evidence_ids": [
        "E028",
        "E029",
        "E030"
      ],
      "privacy_observation": "POTENTIAL_SENSITIVE_CONTENT",
      "required": true,
      "selected_frame_count": 3,
      "source_ref": "N31_VIDEO_OPERATION_FULL",
      "start_ms": 135000,
      "step_id": "S07",
      "title": "关闭顶盖并调节后方进纸导轨",
      "visual_confidence": 0.6,
      "visual_verdict": "PARTIAL",
      "window_id": "S07-W01"
    },
    {
      "dgx_candidate_count": 8,
      "dgx_candidate_timestamps_ms": [
        19000,
        20000,
        21000,
        22000,
        23000,
        24000,
        33000,
        34000
      ],
      "duration_ms": 15000,
      "end_ms": 35000,
      "evidence_ids": [
        "E073",
        "E074",
        "E075"
      ],
      "privacy_observation": "POTENTIAL_SENSITIVE_CONTENT",
      "required": true,
      "selected_frame_count": 3,
      "source_ref": "N31_VIDEO_GUIDES",
      "start_ms": 20000,
      "step_id": "S07",
      "title": "关闭顶盖并调节后方进纸导轨",
      "visual_confidence": 0.6,
      "visual_verdict": "PARTIAL",
      "window_id": "S07-W02"
    },
    {
      "dgx_candidate_count": 0,
      "dgx_candidate_timestamps_ms": [],
      "duration_ms": 15000,
      "end_ms": 175000,
      "evidence_ids": [
        "E033",
        "E034",
        "E035"
      ],
      "privacy_observation": "POTENTIAL_SENSITIVE_CONTENT",
      "required": true,
      "selected_frame_count": 3,
      "source_ref": "N31_VIDEO_OPERATION_FULL",
      "start_ms": 160000,
      "step_id": "S08",
      "title": "插入标签纸并确认自动吸纸",
      "visual_confidence": 0.6,
      "visual_verdict": "PARTIAL",
      "window_id": "S08-W01"
    },
    {
      "dgx_candidate_count": 5,
      "dgx_candidate_timestamps_ms": [
        0,
        5000,
        6000,
        9000,
        10000
      ],
      "duration_ms": 10000,
      "end_ms": 10000,
      "evidence_ids": [
        "E079",
        "E080"
      ],
      "privacy_observation": "POTENTIAL_SENSITIVE_CONTENT",
      "required": true,
      "selected_frame_count": 2,
      "source_ref": "N31_VIDEO_MEDIA_FEED",
      "start_ms": 0,
      "step_id": "S08",
      "title": "插入标签纸并确认自动吸纸",
      "visual_confidence": 0.6,
      "visual_verdict": "PARTIAL",
      "window_id": "S08-W02"
    },
    {
      "dgx_candidate_count": 0,
      "dgx_candidate_timestamps_ms": [],
      "duration_ms": 15000,
      "end_ms": 200000,
      "evidence_ids": [
        "E038",
        "E039",
        "E040"
      ],
      "privacy_observation": "POTENTIAL_SENSITIVE_CONTENT",
      "required": true,
      "selected_frame_count": 3,
      "source_ref": "N31_VIDEO_OPERATION_FULL",
      "start_ms": 185000,
      "step_id": "S09",
      "title": "执行缝标学习",
      "visual_confidence": 0.6,
      "visual_verdict": "PARTIAL",
      "window_id": "S09-W01"
    },
    {
      "dgx_candidate_count": 10,
      "dgx_candidate_timestamps_ms": [
        0,
        1000,
        2000,
        3000,
        4000,
        5000,
        6000,
        7000,
        8000,
        9000
      ],
      "duration_ms": 9871,
      "end_ms": 9871,
      "evidence_ids": [
        "E077",
        "E078"
      ],
      "privacy_observation": "POTENTIAL_SENSITIVE_CONTENT",
      "required": true,
      "selected_frame_count": 2,
      "source_ref": "N31_VIDEO_LEARNING",
      "start_ms": 0,
      "step_id": "S09",
      "title": "执行缝标学习",
      "visual_confidence": 0.6,
      "visual_verdict": "PARTIAL",
      "window_id": "S09-W02"
    },
    {
      "dgx_candidate_count": 0,
      "dgx_candidate_timestamps_ms": [],
      "duration_ms": 15000,
      "end_ms": 225000,
      "evidence_ids": [
        "E043",
        "E044",
        "E045"
      ],
      "privacy_observation": "POTENTIAL_SENSITIVE_CONTENT",
      "required": true,
      "selected_frame_count": 3,
      "source_ref": "N31_VIDEO_OPERATION_FULL",
      "start_ms": 210000,
      "step_id": "S10",
      "title": "执行单张走纸检查",
      "visual_confidence": 0.7,
      "visual_verdict": "PARTIAL",
      "window_id": "S10-W01"
    },
    {
      "dgx_candidate_count": 0,
      "dgx_candidate_timestamps_ms": [],
      "duration_ms": 15000,
      "end_ms": 245000,
      "evidence_ids": [
        "E047",
        "E048",
        "E049"